{
  "$schema": "./zskills-config.schema.json",
  "project_name": "nanogen",
  "timezone": "America/New_York",
  "execution": {
    "landing": "cherry-pick",
    "main_protected": false,
    "branch_prefix": "feat/"
  },
  "testing": {
    "unit_cmd": "cd .claude/skills/nanogen && npm test",
    "full_cmd": "",
    "output_file": ".test-results.txt",
    "file_patterns": [
      ".claude/skills/nanogen/**/*.cjs",
      ".claude/skills/nanogen/**/*.json"
    ]
  },
  "dev_server": {
    "cmd": "",
    "port_script": "scripts/port.sh",
    "main_repo_path": "/workspaces/nanogen"
  },
  "ui": {
    "file_patterns": "",
    "auth_bypass": ""
  },
  "ci": {
    "auto_fix": true,
    "max_fix_attempts": 2
  },
  "agents": {
    "min_model": "auto"
  }
}
